{
  "$schema": "http://json-schema.org/draft-07/schema#",
  "$id": "https://sgogi-coach.local/schemas/openings.schema.json",
  "title": "Opening",
  "description": "戦型(例: 四間飛車、居飛車)。将来の対局シナリオ拡張(docs/SCENARIOS.md)を見込んだ器を持つが、scenarioフィールドは現段階では使用しない。",
  "type": "object",
  "additionalProperties": false,
  "required": ["id", "name", "name_kana", "side", "family", "leads_to_shape_ids", "confidence_level", "source", "review_status"],
  "properties": {
    "id": {
      "type": "string",
      "pattern": "^[a-z0-9_]+$",
      "description": "一意な識別子(例: shikenbisha)"
    },
    "name": { "type": "string", "description": "表記(例: 四間飛車)" },
    "name_kana": { "type": "string", "description": "読み仮名" },
    "side": {
      "type": "string",
      "enum": ["self", "opponent"],
      "description": "self=自分側の戦型, opponent=相手側の戦型"
    },
    "family": {
      "type": "string",
      "description": "分類(例: 振り飛車系、居飛車系)"
    },
    "leads_to_shape_ids": {
      "type": "array",
      "description": "この戦型がつながりやすい shapes.id の一覧",
      "items": { "type": "string" }
    },
    "scenario": {
      "type": ["object", "null"],
      "additionalProperties": false,
      "description": "対局シナリオ(AI序盤制御)の制御用データ。制御方式は「序盤の数手をmovesの手順で強制進行させ、以降はエンジンに任せる」(人間承認済み)。docs/SCENARIOS.md・docs/KIND3_VERIFICATION.md 参照。実データへの値の投入は、docs/KIND3_VERIFICATION.md の検証と Phase F の人間による最終採用判断を経てから行う(現時点では null)",
      "required": ["status", "variants"],
      "properties": {
        "status": {
          "type": "string",
          "enum": ["not_implemented", "defined"],
          "description": "not_implemented=受け皿のみ、defined=variantsが定義済み"
        },
        "variants": {
          "type": "array",
          "minItems": 1,
          "description": "相手AIが毎局1つを選ぶ候補。選んだものはユーザーへ開示しない(docs/PHASES.md Phase 4)",
          "items": {
            "type": "object",
            "additionalProperties": false,
            "required": ["id", "target_intent_id", "moves", "verification_method", "verification_status"],
            "properties": {
              "id": { "type": "string", "pattern": "^[a-z0-9_]+$", "description": "variantの一意な識別子" },
              "target_intent_id": {
                "type": "string",
                "description": "この手順が実現しようとする intents.id。docs/KIND3_VERIFICATION.md Phase A-3 の検証時にテスト・オラクルとして参照するためのものであり、実行時のAI制御手順の生成・選択には使用しない(docs/SCENARIOS.md の認識用データと制御用データの分離)"
              },
              "moves": {
                "type": "array",
                "minItems": 1,
                "items": { "type": "string" },
                "description": "強制進行させる相手側の手順(USI形式、指す順)。座標形式の規約は docs/DATA_MODEL.md"
              },
              "source": { "type": "string", "description": "手順の出典・作成経緯" },
              "verification_method": {
                "type": ["string", "null"],
                "enum": ["expert_review", "ai_multi_stage", null],
                "description": "どの方法で検証したか。expert_reviewは有段者レビューを実施した場合のみ。定義は docs/KIND3_VERIFICATION.md"
              },
              "verification_status": {
                "type": "string",
                "enum": ["unverified", "ai_verified", "human_approved"],
                "description": "検証・採用状態。human_approvedは人間のみが設定できる。review_status(ユーザーへの知識露出の制御)とは完全に分離し、一方の値から他方を導出しない"
              },
              "verification_record": {
                "type": ["object", "null"],
                "additionalProperties": true,
                "description": "検証の記録(使用エンジン名・バージョン・探索条件・各Phaseの結果・不一致の有無・最終判断者・日付など)。記録項目が運用で変わりうるため中身を固定しない"
              }
            }
          }
        }
      }
    },
    "recognition_pattern": {
      "type": "array",
      "minItems": 1,
      "description": "この戦型を指し手の並びから認識するための手がかり(任意フィールド。値を持たない戦型は認識の候補にならない)。「飛車を初期位置から動かさない」のような否定的な条件は現在の表現では書けない(その表現方法は未確定であり、必要になった時点で人間の承認を経て決める)",
      "items": {
        "type": "object",
        "additionalProperties": false,
        "required": ["piece", "to"],
        "properties": {
          "piece": { "type": "string", "description": "動く駒(例: 銀)" },
          "to": { "type": "string", "description": "移動先のマス目(USI形式、例: 3f)、または移動先の傾向" },
          "order_hint": { "type": "integer", "description": "手順の中でのおおよその順序(任意)" }
        }
      }
    },
    "source": { "type": "string", "description": "参考にした出典" },
    "confidence_level": {
      "type": "string",
      "enum": ["high", "medium", "low"],
      "description": "内容の確からしさ"
    },
    "review_status": {
      "type": "string",
      "enum": ["draft", "human_reviewed", "expert_verified"],
      "description": "知識を追加してよいかと、ユーザーへ見せてよいかを分離する運用区分。draft=AIが追加した未レビューの知識(戦法・狙い・陣形の名前としてユーザーへ断定的に見せる経路では使わない)、human_reviewed=人間のレビューを経たもの、expert_verified=有段者・一次資料による確認を経たもの。意味の定義はdocs/DATA_MODEL.mdを正とする"
    }
  }
}
