{
  "id": "hayakurigin",
  "name": "早繰り銀",
  "name_kana": "はやくりぎん",
  "side": "self",
  "family": "相居飛車",
  "leads_to_shape_ids": [
    "yagura_kinyagura",
    "funagakoi"
  ],
  "scenario": null,
  "recognition_pattern": [
    {
      "piece": "銀",
      "to": "4f",
      "order_hint": 1
    },
    {
      "piece": "歩",
      "to": "3e",
      "order_hint": 2
    }
  ],
  "source": "【AI起草 / 出典は下記】Wikipedia『早繰り銀』(https://ja.wikipedia.org/wiki/早繰り銀 (参照日 2026-09-25))による。▲4六銀から▲3五歩と仕掛ける攻め方で、相掛かりでは浮き飛車(2六飛型)から用いることがある。出典は銀の全行程(3九→4八→3七→4六)を明示していないため、recognition_pattern には出典が挙げた 4六銀 と 3五歩 だけを置いた。 戦型を認識するコードは apps/server/src/analysis/ に無いため、このレコードを足しても認識の数は動かない(2026-09-25 司令塔の訂正、docs/KNOWLEDGE_LANE_BRIEF_2026-09-25.md §5.1)。座標は先手の絶対座標(docs/DATA_MODEL.md の規約)。追加の経緯: 2026-09-25 の知識レーン第 17 組(docs/LANE_KNOWLEDGE_LOG_2026-09.md §20)。人間の決定(2026-09-25、網羅)による目録の埋め。",
  "confidence_level": "medium",
  "review_status": "draft"
}
