{
  "id": "ai_yokofudori",
  "name": "相横歩取り",
  "name_kana": "あいよこふどり",
  "side": "opponent",
  "family": "横歩取り",
  "leads_to_shape_ids": [],
  "scenario": null,
  "recognition_pattern": [
    {
      "piece": "飛",
      "to": "7f",
      "order_hint": 1
    }
  ],
  "source": "【AI起草 / 出典は下記】**横歩取りは後手がとる指し方が名前になっているものが多く、この 6 件はすべて `side: opponent`(後手)である。** Wikipedia『相横歩取り』(https://ja.wikipedia.org/wiki/相横歩取り (参照日 2026-09-25))による。後手も横歩を取る形で、△8八角成 ▲同銀 △7六飛 と進む(後手の飛車が 7六 に出る)。先手の 1 歩損にならないぶん後手に好まれるが、現代は基本図から飛車交換に進む超急戦が多い。 座標は後手の絶対座標(docs/DATA_MODEL.md の規約)。戦型を認識するコードは apps/server/src/analysis/ に無いため、このレコードを足しても認識の数は動かない(2026-09-25 司令塔の訂正、docs/KNOWLEDGE_LANE_BRIEF_2026-09-25.md §5.1)。追加の経緯: 2026-09-25 の知識レーン第 20 組(docs/LANE_KNOWLEDGE_LOG_2026-09.md §23)。人間の決定(2026-09-25、網羅)による目録の埋め。",
  "confidence_level": "medium",
  "review_status": "draft"
}
