{
  "id": "kanazawaryu",
  "name": "金沢流",
  "name_kana": "かなざわりゅう",
  "side": "self",
  "family": "向かい飛車",
  "leads_to_shape_ids": [
    "mino_honmino"
  ],
  "scenario": null,
  "recognition_pattern": [
    {
      "piece": "角",
      "to": "6f",
      "order_hint": 1
    },
    {
      "piece": "飛",
      "to": "8h",
      "order_hint": 2
    }
  ],
  "source": "【AI起草 / 出典は下記】Wikipedia『金沢流』(https://ja.wikipedia.org/wiki/金沢流 (参照日 2026-09-25))による。初手 ▲7六歩 △3四歩 に **▲6六角 と出る『3手目▲6六角』**として知られる力戦誘導型の奇襲(2014 年の王位戦予選で金沢孝史が使用)。そのあと頃合いを見て ▲8八飛 と向かい飛車にし、▲8六歩 △同歩 ▲8四歩 などを狙う。**8八飛 は既存の mukaibisha(向かい飛車)と同じマス**で、区別は 6六角。 座標は先手の絶対座標(docs/DATA_MODEL.md の規約)。戦型を認識するコードは apps/server/src/analysis/ に無いため、このレコードを足しても認識の数は動かない(2026-09-25 司令塔の訂正)。追加の経緯: 2026-09-25 の知識レーン第 24 組(docs/LANE_KNOWLEDGE_LOG_2026-09.md §27)。人間の決定(2026-09-25、網羅)による目録の埋め。",
  "confidence_level": "medium",
  "review_status": "draft"
}
