{
  "id": "tatefudori",
  "name": "縦歩取り",
  "name_kana": "たてふどり",
  "side": "self",
  "family": "相掛かり",
  "leads_to_shape_ids": [
    "funagakoi"
  ],
  "scenario": null,
  "recognition_pattern": [
    {
      "piece": "飛",
      "to": "2f",
      "order_hint": 1
    },
    {
      "piece": "飛",
      "to": "3f",
      "order_hint": 2
    }
  ],
  "source": "【AI起草 / 出典は下記】Wikipedia『縦歩取り』(https://ja.wikipedia.org/wiki/縦歩取り (参照日 2026-09-25))による。相掛かりの浮き飛車(2六)から▲3六飛と一つ寄り、相手の 3四歩 を狙う。実際には歩を取らせず相手を悪形にすることが狙いだと出典は述べている。recognition_pattern は 2六飛 → 3六飛 の 2 件。 戦型を認識するコードは apps/server/src/analysis/ に無いため、このレコードを足しても認識の数は動かない(2026-09-25 司令塔の訂正、docs/KNOWLEDGE_LANE_BRIEF_2026-09-25.md §5.1)。座標は先手の絶対座標(docs/DATA_MODEL.md の規約)。追加の経緯: 2026-09-25 の知識レーン第 17 組(docs/LANE_KNOWLEDGE_LOG_2026-09.md §20)。人間の決定(2026-09-25、網羅)による目録の埋め。",
  "confidence_level": "medium",
  "review_status": "draft"
}
