{
  "id": "yokofudori_45kaku",
  "name": "横歩取り4五角",
  "name_kana": "よこふどりしごかく",
  "side": "opponent",
  "family": "横歩取り",
  "leads_to_shape_ids": [],
  "scenario": null,
  "recognition_pattern": [
    {
      "piece": "角",
      "to": "4e",
      "order_hint": 1
    }
  ],
  "source": "【AI起草 / 出典は下記】**横歩取りは後手がとる指し方が名前になっているものが多く、この 6 件はすべて `side: opponent`(後手)である。** Wikipedia『横歩取り4五角』(https://ja.wikipedia.org/wiki/横歩取り4五角 (参照日 2026-09-25))による。△8八角成 ▲同銀 と角を交換し、△2八歩 ▲同銀 と取らせてから △4五角 と出る。江戸時代からある指し方で、昭和に谷川浩司らが再評価した。 座標は後手の絶対座標(docs/DATA_MODEL.md の規約)。戦型を認識するコードは apps/server/src/analysis/ に無いため、このレコードを足しても認識の数は動かない(2026-09-25 司令塔の訂正、docs/KNOWLEDGE_LANE_BRIEF_2026-09-25.md §5.1)。追加の経緯: 2026-09-25 の知識レーン第 20 組(docs/LANE_KNOWLEDGE_LOG_2026-09.md §23)。人間の決定(2026-09-25、網羅)による目録の埋め。",
  "confidence_level": "medium",
  "review_status": "draft"
}
