{
  "id": "youryuu_shikenbisha",
  "name": "耀龍四間飛車",
  "name_kana": "ようりゅうしけんびしゃ",
  "side": "self",
  "family": "振り飛車系",
  "leads_to_shape_ids": [],
  "scenario": null,
  "recognition_pattern": [
    {
      "piece": "飛",
      "to": "6h",
      "order_hint": 1
    },
    {
      "piece": "玉",
      "to": "3h",
      "order_hint": 2
    }
  ],
  "source": "【AI起草】自分側(先手)の耀龍四間飛車。四間飛車のうち、玉を美濃囲いに入れず 3八 に置いたまま戦うもの。定義は Wikipedia『耀龍四間飛車』(https://ja.wikipedia.org/wiki/耀龍四間飛車 (参照日 2026-09-25)) の本文(囲いを美濃囲いにせず、先手なら3八玉型・後手なら7二玉型で戦う)による。recognition_pattern は 2 手(6八飛・3八玉)。**3八玉は振り飛車早囲い(`mino_hayagakoi`)や金無双(`kinmusou`)の玉と同じマス**なので、囲いの側だけを見ると区別がつかない。leads_to_shape_ids は置いていない(出典が「美濃囲いにしない」と述べているだけで、代わりの形を 1 つに定めていないため)。 戦型を認識するコードは apps/server/src/analysis/ に無いため、このレコードを足しても認識の数は動かない(**測れない**)。 追加の経緯: 2026-09-25 の知識レーン第 9 組(docs/LANE_KNOWLEDGE_LOG_2026-09.md §11)。振り飛車の各系統。",
  "confidence_level": "medium",
  "review_status": "draft"
}
