{
  "id": "eichanryu_nakabisha",
  "name": "英ちゃん流中飛車",
  "name_kana": "えいちゃんりゅうなかびしゃ",
  "side": "self",
  "family": "中飛車",
  "leads_to_shape_ids": [
    "mino_honmino"
  ],
  "scenario": null,
  "recognition_pattern": [
    {
      "piece": "飛",
      "to": "5h",
      "order_hint": 1
    },
    {
      "piece": "銀",
      "to": "6h",
      "order_hint": 2
    }
  ],
  "source": "【AI起草 / 出典は下記】Wikipedia『英ちゃん流中飛車』(https://ja.wikipedia.org/wiki/英ちゃん流中飛車 (参照日 2026-09-25))による。山口英夫の中飛車で、**骨格は「5筋の歩を突かない」こと**(5筋を保留して相手の対応を見る。当時流行の玉頭位取りへの対抗として考えられた)。**この「突かない」はスキーマで表せない**(否定で定義される戦型の 3 例目。飛車先不突矢倉・ノーガード戦法と同じ型)。そのため recognition_pattern には出典の図から読める 5八飛・6八銀 だけを置いたが、**これだけでは普通の中飛車と区別できない。** 座標は先手の絶対座標(docs/DATA_MODEL.md の規約)。戦型を認識するコードは apps/server/src/analysis/ に無いため、このレコードを足しても認識の数は動かない(2026-09-25 司令塔の訂正、docs/KNOWLEDGE_LANE_BRIEF_2026-09-25.md §5.1)。追加の経緯: 2026-09-25 の知識レーン第 23 組(docs/LANE_KNOWLEDGE_LOG_2026-09.md §26)。人間の決定(2026-09-25、網羅)による目録の埋め。",
  "confidence_level": "low",
  "review_status": "draft"
}
