{
  "id": "sankenbisha_opponent",
  "name": "三間飛車",
  "name_kana": "さんけんびしゃ",
  "side": "opponent",
  "family": "振り飛車系",
  "leads_to_shape_ids": [],
  "scenario": null,
  "recognition_pattern": [
    {
      "piece": "飛",
      "to": "3b",
      "order_hint": 1
    }
  ],
  "source": "【AI起草】相手側(後手)の三間飛車。定義は Wikipedia『三間飛車』(https://ja.wikipedia.org/wiki/三間飛車 (参照日 2026-09-25)) の冒頭(後手なら3筋)による。recognition_pattern の 3b(３二飛)は後手の絶対座標(data/intents/ と同じ規約。docs/DATA_MODEL.md の座標表記)。相手側の陣形(shapes)は data/ にまだ無いので leads_to_shape_ids は空。 戦型を認識するコードは apps/server/src/analysis/ に無いため、このレコードを足しても認識の数は動かない(**測れない**。2026-09-25 司令塔の訂正、KNOWLEDGE_LANE_BRIEF §5.1)。 追加の経緯: 2026-09-25 の知識レーン第 5 組(docs/LANE_KNOWLEDGE_LOG_2026-09.md §7)。4 人分の実棋譜 70 局の 40 手目で、この筋に飛車があった局を数えて選んだ。",
  "confidence_level": "high",
  "review_status": "draft"
}
