{
  "id": "kakugawari",
  "name": "角換わり",
  "name_kana": "かくがわり",
  "side": "self",
  "family": "居飛車系",
  "leads_to_shape_ids": [],
  "scenario": null,
  "recognition_pattern": [
    {
      "piece": "角",
      "to": "7g",
      "order_hint": 1
    },
    {
      "piece": "銀",
      "to": "7g",
      "order_hint": 2
    }
  ],
  "source": "【AI起草】自分側(先手)の角換わり。序盤で角を交換してから駒組みを進める相居飛車の戦型。定義と手順は Wikipedia『角換わり』(https://ja.wikipedia.org/wiki/角換わり (参照日 2026-09-25)) の本文(▲7六歩△8四歩▲2六歩△3二金▲2五歩△8五歩▲7七角△3四歩▲6八銀△7七角成▲同銀△2二銀。後手が 7七 で角を交換して戦型が決まる)による。recognition_pattern は先手の ▲7七角 と ▲同銀 を写した 2 手(どちらも 7g)。**角の交換そのもの(相手の駒を取る・持ち駒になる)はスキーマの駒種 + 移動先では書けない**ため、7七 に角が上がり、のちに銀が 7七 へ来たという跡で代用している。 戦型を認識するコードは apps/server/src/analysis/ に無いため、このレコードを足しても認識の数は動かない(**測れない**)。 追加の経緯: 2026-09-25 の知識レーン第 6 組(docs/LANE_KNOWLEDGE_LOG_2026-09.md §8)。相居飛車の 4 系統(4 人の棋譜で自分の飛車が 2 筋だった 21 局・相手が 8 筋だった 31 局が当たる)と、その中の代表的な指し方。",
  "confidence_level": "medium",
  "review_status": "draft"
}
