{
  "id": "yagura_ryu_nakabisha",
  "name": "矢倉流中飛車",
  "name_kana": "やぐらりゅうなかびしゃ",
  "side": "opponent",
  "family": "中飛車",
  "leads_to_shape_ids": [],
  "scenario": null,
  "recognition_pattern": [
    {
      "piece": "飛",
      "to": "5b",
      "order_hint": 1
    },
    {
      "piece": "銀",
      "to": "5c",
      "order_hint": 2
    },
    {
      "piece": "銀",
      "to": "6d",
      "order_hint": 3
    }
  ],
  "source": "【AI起草 / 出典は下記】Wikipedia『矢倉流中飛車』(https://ja.wikipedia.org/wiki/矢倉流中飛車 (参照日 2026-09-25))による。矢倉規広が考案。角道を止めた中飛車から **△5三銀 → △6四銀 と進める**のが骨子で、相手の穴熊への対策として働く。**出典の要約は先手・後手の記述が混ざっていたが、引用されている指し手が △(後手)なので `side: opponent` とした**(推測を含む。low)。 座標は後手の絶対座標(docs/DATA_MODEL.md の規約)。戦型を認識するコードは apps/server/src/analysis/ に無いため、このレコードを足しても認識の数は動かない(2026-09-25 司令塔の訂正、docs/KNOWLEDGE_LANE_BRIEF_2026-09-25.md §5.1)。追加の経緯: 2026-09-25 の知識レーン第 23 組(docs/LANE_KNOWLEDGE_LOG_2026-09.md §26)。人間の決定(2026-09-25、網羅)による目録の埋め。",
  "confidence_level": "low",
  "review_status": "draft"
}
