{
  "id": "sanhachi_bisha",
  "name": "3八飛戦法",
  "name_kana": "さんはちびしゃせんぽう",
  "side": "self",
  "family": "居飛車一般",
  "leads_to_shape_ids": [
    "funagakoi"
  ],
  "scenario": null,
  "recognition_pattern": [
    {
      "piece": "飛",
      "to": "3h",
      "order_hint": 1
    },
    {
      "piece": "銀",
      "to": "4g",
      "order_hint": 2
    }
  ],
  "source": "【AI起草 / 出典は下記】Wikipedia『3八飛戦法』(https://ja.wikipedia.org/wiki/3八飛戦法 (参照日 2026-09-25))による。飛車を左へ 1 マス寄せて 3八(後手なら 7二)に置き、銀は 4七(腰掛け銀の形)。角道の入口をにらんで相手の角の動きを牽制し、対振り飛車では角の頭の弱点を狙う。**既存の sodebisha・kato_sodebisha と 3八飛 が同じ**で、こちらは 4七銀 を伴う。 座標は先手の絶対座標(docs/DATA_MODEL.md の規約)。戦型を認識するコードは apps/server/src/analysis/ に無いため、このレコードを足しても認識の数は動かない(2026-09-25 司令塔の訂正、docs/KNOWLEDGE_LANE_BRIEF_2026-09-25.md §5.1)。追加の経緯: 2026-09-25 の知識レーン第 22 組(docs/LANE_KNOWLEDGE_LOG_2026-09.md §25)。人間の決定(2026-09-25、網羅)による目録の埋め。",
  "confidence_level": "medium",
  "review_status": "draft"
}
