{
  "id": "yokofudori_23fu",
  "name": "横歩取り2三歩",
  "name_kana": "よこふどりにさんふ",
  "side": "opponent",
  "family": "横歩取り",
  "leads_to_shape_ids": [],
  "scenario": null,
  "source": "【AI起草 / 出典は下記】**横歩取りは後手がとる指し方が名前になっているものが多く、この 6 件はすべて `side: opponent`(後手)である。** Wikipedia『横歩取り2三歩』(https://ja.wikipedia.org/wiki/横歩取り2三歩 (参照日 2026-09-25))による。先手が ▲2四飛 と横歩を取ったあと、後手が △2三歩 と打つ。昭和末期の研究以降は先手が指せるとされ、現代のプロでは稀。 座標は後手の絶対座標(docs/DATA_MODEL.md の規約)。戦型を認識するコードは apps/server/src/analysis/ に無いため、このレコードを足しても認識の数は動かない(2026-09-25 司令塔の訂正、docs/KNOWLEDGE_LANE_BRIEF_2026-09-25.md §5.1)。追加の経緯: 2026-09-25 の知識レーン第 20 組(docs/LANE_KNOWLEDGE_LOG_2026-09.md §23)。人間の決定(2026-09-25、網羅)による目録の埋め。 **2026-09-25 の第 30 組で recognition_pattern を外した(司令塔の判断)**。理由: 出典の定義は「△2三歩と**打つ**」ことであって、「2三に歩がある」ことではない。**打った手かどうかは、いまのスキーマでは盤に駒があることと区別できない**(docs/LANE_KNOWLEDGE_LOG_2026-09.md §31.2 の型 5「盤から駒が消える/現れる」)。**2三 は後手の歩の初期配置**なので、パターンを置いたままだと相手が 1 手も指していない局面で completed になり、4 人 70 局の実測では 70 局すべてで立ち、証拠 0 の completed 1021 件(30 手まで)のすべてがこの 1 件から出ていた(同 §35)。レコードは消さず、名前と出典と「書けない理由」を残す(藤井システム・ゴキゲン中飛車と同じ扱い)。",
  "confidence_level": "low",
  "review_status": "draft"
}
