{
  "id": "koshikakegin",
  "name": "腰掛け銀",
  "name_kana": "こしかけぎん",
  "side": "self",
  "family": "居飛車系",
  "leads_to_shape_ids": [],
  "scenario": null,
  "recognition_pattern": [
    {
      "piece": "銀",
      "to": "5f",
      "order_hint": 1
    }
  ],
  "source": "【AI起草】自分側(先手)の腰掛け銀。定義は Wikipedia『腰掛け銀』(https://ja.wikipedia.org/wiki/腰掛け銀 (参照日 2026-09-25)) の本文(先手なら ▲5六銀、後手なら △5四銀 と構える。5七(後手は 5三)に歩があり、その上に銀が腰掛けているように見えることが名前の由来)による。recognition_pattern は **5六 への銀** 1 手。**「5七に歩がある」という前提はスキーマでは書けない**(歩は初期位置が 5七 なので、そこへ動く手が存在しない。駒種 + 移動先の並びでは初期位置にある駒を条件にできない)。したがってこの 1 手は、歩が突かれていない形も含めて当たる。 戦型を認識するコードは apps/server/src/analysis/ に無いため、このレコードを足しても認識の数は動かない(**測れない**)。 追加の経緯: 2026-09-25 の知識レーン第 6 組(docs/LANE_KNOWLEDGE_LOG_2026-09.md §8)。相居飛車の 4 系統(4 人の棋譜で自分の飛車が 2 筋だった 21 局・相手が 8 筋だった 31 局が当たる)と、その中の代表的な指し方。",
  "confidence_level": "medium",
  "review_status": "draft"
}
